<?xml version="1.0" encoding="UTF-8"?>
<!DOCTYPE nba SYSTEM "players.dtd">
<nba dataset="allstars">
<division id="East"><player><playerid>leeda02</playerid><firstname>David</firstname><lastname>Lee</lastname><position>F</position><points>4</points><minutes>12</minutes><teamname>New York Knicks</teamname><teamid>NYK</teamid></player><player><playerid>boshch01</playerid><firstname>Christopher</firstname><lastname>Bosh</lastname><position>F</position><points>23</points><minutes>29</minutes><teamname>Toronto Raptors</teamname><teamid>TOR</teamid></player><player><playerid>rosede01</playerid><firstname>Derrick</firstname><lastname>Rose</lastname><position>G</position><points>8</points><minutes>15</minutes><teamname>Chicago Bulls</teamname><teamid>CHI</teamid></player><player><playerid>wadedw01</playerid><firstname>Dwyane</firstname><lastname>Wade</lastname><position>G</position><points>28</points><minutes>31</minutes><teamname>Miami Heat</teamname><teamid>MIA</teamid></player><player><playerid>duncati01</playerid><firstname>Timothy</firstname><lastname>Duncan</lastname><position>C-F</position><points>3</points><minutes>13</minutes><teamname>San Antonio Spurs</teamname><teamid>SAS</teamid></player><player><playerid>garneke01</playerid><firstname>Kevin</firstname><lastname>Garnett</lastname><position>F</position><points>4</points><minutes>13</minutes><teamname>Boston Celtics</teamname><teamid>BOS</teamid></player><player><playerid>horfoal01</playerid><firstname>Alfred</firstname><lastname>Horford Reynoso</lastname><position>F-C</position><points>8</points><minutes>14</minutes><teamname>Atlanta Hawks</teamname><teamid>ATL</teamid></player><player><playerid>howardw01</playerid><firstname>Dwight</firstname><lastname>Howard</lastname><position>F</position><points>17</points><minutes>27</minutes><teamname>Orlando Magic</teamname><teamid>ORL</teamid></player><player><playerid>jamesle01</playerid><firstname>LeBron</firstname><lastname>James</lastname><position>F</position><points>25</points><minutes>32</minutes><teamname>Cleveland Cavaliers</teamname><teamid>CLE</teamid></player><player><playerid>johnsjo02</playerid><firstname>Joe</firstname><lastname>Johnson</lastname><position>G-F</position><points>10</points><minutes>18</minutes><teamname>Atlanta Hawks</teamname><teamid>ATL</teamid></player><player><playerid>piercpa01</playerid><firstname>Paul</firstname><lastname>Pierce</lastname><position>F</position><points>8</points><minutes>11</minutes><teamname>Boston Celtics</teamname><teamid>BOS</teamid></player><player><playerid>rondora01</playerid><firstname>Rajon</firstname><lastname>Rondo</lastname><position>F</position><points>4</points><minutes>20</minutes><teamname>Boston Celtics</teamname><teamid>BOS</teamid></player><player><playerid>wallage01</playerid><firstname>Gerald</firstname><lastname>Wallace</lastname><position>F</position><points>2</points><minutes>16</minutes><teamname>Charlotte Bobcats</teamname><teamid>CHA</teamid></player></division>
<division id="West"><player><playerid>kiddja01</playerid><firstname>Jason</firstname><lastname>Kidd</lastname><position>G</position><points>0</points><minutes>6</minutes><teamname>Dallas Mavericks</teamname><teamid>DAL</teamid></player><player><playerid>nashst01</playerid><firstname>Stephen</firstname><lastname>Nash</lastname><position>G</position><points>4</points><minutes>20</minutes><teamname>Phoenix Suns</teamname><teamid>PHO</teamid></player><player><playerid>anthoca01</playerid><firstname>Carmelo</firstname><lastname>Anthony</lastname><position>F</position><points>27</points><minutes>29</minutes><teamname>Denver Nuggets</teamname><teamid>DEN</teamid></player><player><playerid>billuch01</playerid><firstname>Chauncey</firstname><lastname>Billups</lastname><position>G</position><points>17</points><minutes>26</minutes><teamname>Denver Nuggets</teamname><teamid>DEN</teamid></player><player><playerid>duncati01</playerid><firstname>Timothy</firstname><lastname>Duncan</lastname><position>C-F</position><points>3</points><minutes>13</minutes><teamname>San Antonio Spurs</teamname><teamid>SAS</teamid></player><player><playerid>duranke01</playerid><firstname>Kevin</firstname><lastname>Durant</lastname><position>F</position><points>15</points><minutes>20</minutes><teamname>Oklahoma City Thunder</teamname><teamid>OKC</teamid></player><player><playerid>gasolpa01</playerid><firstname>Pau</firstname><lastname>Gasol Saez</lastname><position>F</position><points>13</points><minutes>20</minutes><teamname>Los Angeles Lakers</teamname><teamid>LAL</teamid></player><player><playerid>kamanch01</playerid><firstname>Christopher</firstname><lastname>Kaman</lastname><position>C</position><points>4</points><minutes>11</minutes><teamname>Los Angeles Clippers</teamname><teamid>LAC</teamid></player><player><playerid>nowitdi01</playerid><firstname>Dirk</firstname><lastname>Nowitzki</lastname><position>C</position><points>22</points><minutes>28</minutes><teamname>Dallas Mavericks</teamname><teamid>DAL</teamid></player><player><playerid>randoza01</playerid><firstname>Zachary</firstname><lastname>Randolph</lastname><position>F</position><points>8</points><minutes>19</minutes><teamname>Memphis Grizzlies</teamname><teamid>MEM</teamid></player><player><playerid>stoudam01</playerid><firstname>Amar&apos;e</firstname><lastname>Stoudemire</lastname><position>F-C</position><points>12</points><minutes>20</minutes><teamname>Phoenix Suns</teamname><teamid>PHO</teamid></player><player><playerid>willide01</playerid><firstname>Deron</firstname><lastname>Williams</lastname><position>G</position><points>14</points><minutes>28</minutes><teamname>Utah Jazz</teamname><teamid>UTA</teamid></player></division>
</nba>